{
  "$schema": "http://json-schema.org/draft-07/schema#",
  "title": "Omoluabi Lesson Schema",
  "type": "object",
  "properties": {
    "id": { "type": "string" },
    "title": { "type": "string" },
    "language": { "type": "string" },
    "questions": {
      "type": "array",
      "items": {
        "type": "object",
        "properties": {
          "type": {
            "type": "string",
            "enum": ["multiple-choice", "translate", "match", "listen"]
          },
          "sentence": { "type": "string" },
          "translation": { "type": "string" },
          "options": {
            "type": "array",
            "items": { "type": "string" }
          },
          "correctAnswer": { "type": "string" },
          "audioUrl": { "type": "string" }
        },
        "required": ["type", "sentence", "correctAnswer"]
      }
    }
  },
  "required": ["id", "title", "language", "questions"]
}
